{"$schema":"https://json-schema.org/draft/2020-12/schema","$id":"post.schema.json","type":"object","additionalProperties":false,"required":["id","topicId","sourceUrl","sourcePlatform","sourceName","originalTitle","displayTitle","hook","shortSummary","language","collectedAt","qualityScore","interestingnessScore","educationalValueScore","difficulty","conceptIds","claimIds","suggestedQuestionIds","status"],"properties":{"id":{"type":"string","minLength":1,"maxLength":128},"topicId":{"type":"string","minLength":1,"maxLength":128},"sourceUrl":{"type":"string","format":"uri","pattern":"^https://","maxLength":2048},"sourcePlatform":{"enum":["youtube","article","blog","newsletter","x","reddit","news","other"]},"sourceName":{"type":"string","minLength":1,"maxLength":200},"author":{"type":"string","minLength":1,"maxLength":200},"originalTitle":{"type":"string","minLength":1,"maxLength":500},"displayTitle":{"type":"string","minLength":1,"maxLength":500},"hook":{"type":"string","minLength":1,"maxLength":240},"shortSummary":{"type":"string","minLength":1,"maxLength":800},"longSummary":{"type":"string","minLength":1,"maxLength":2400},"language":{"type":"string","pattern":"^[A-Za-z]{2,3}(-[A-Za-z0-9]{2,8})*$","maxLength":35},"durationSeconds":{"type":"number","minimum":0,"maximum":86400},"readingTimeMinutes":{"type":"number","minimum":0,"maximum":1440},"thumbnailUrl":{"type":"string","format":"uri","pattern":"^https://","maxLength":2048},"originalPublishedAt":{"type":"string","format":"date-time"},"collectedAt":{"type":"string","format":"date-time"},"approvedAt":{"type":"string","format":"date-time"},"qualityScore":{"type":"number","minimum":0,"maximum":1},"interestingnessScore":{"type":"number","minimum":0,"maximum":1},"educationalValueScore":{"type":"number","minimum":0,"maximum":1},"difficulty":{"type":"number","minimum":0,"maximum":1},"viewpoint":{"enum":["supportive","critical","neutral","mixed"]},"conceptIds":{"type":"array","items":{"type":"string","minLength":1,"maxLength":128},"uniqueItems":true,"maxItems":500},"claimIds":{"type":"array","items":{"type":"string","minLength":1,"maxLength":128},"uniqueItems":true,"maxItems":500},"suggestedQuestionIds":{"type":"array","items":{"type":"string","minLength":1,"maxLength":128},"uniqueItems":true,"maxItems":100},"status":{"enum":["raw","preprocessed","approved","rejected","frozen"]}}}
