[
  {
    "id": "candidate-0000",
    "topicId": "ai-agents-future-work",
    "sourceUrl": "https://arxiv.org/html/2505.20120v1",
    "sourcePlatform": "article",
    "sourceName": "arxiv.org",
    "author": "Equal contributions.",
    "originalTitle": "Agents Require Metacognitive and Strategic Reasoning to Succeed in the Coming Labor Markets",
    "displayTitle": "AI Agents and the Economic Forces of Future Labor Markets",
    "hook": "To thrive in emerging labor markets, AI agents must transcend brittle scaffolding by mastering metacognitive self-assessment and strategic reasoning to navigate persistent economic frictions.",
    "shortSummary": "This paper argues that despite technological advancement, fundamental economic forces—adverse selection, moral hazard, and reputation—will define future agentic labor markets. Success requires agents to move beyond external scaffolding toward intrinsic metacognitive and strategic reasoning capabilities.",
    "longSummary": "The authors examine the integration of AI agents into labor markets, asserting that core economic frictions of information asymmetry will persist regardless of technological gains. The paper proposes a conceptual framework for 'agentic labor markets' where agents must possess metacognition (self-assessment and task understanding) to optimize performance and strategic reasoning (theory of mind and adaptive learning) to compete effectively. Contrasting AI agents with the fully rational actors found in traditional economic models, the authors suggest that agents are more likely to behave according to learned heuristics. They argue that training agents in complex, simulated environments—rather than relying on fragile, externally imposed scaffolding—represents a more promising path toward robust, long-term competitiveness. The paper also calls for cross-disciplinary collaboration to develop new safety and governance structures to address potential market failures.",
    "language": "en",
    "readingTimeMinutes": 60,
    "collectedAt": "2026-07-17T02:41:51.262Z",
    "approvedAt": "2026-07-18T00:50:52.596Z",
    "qualityScore": 0.95,
    "interestingnessScore": 0.9,
    "educationalValueScore": 0.9,
    "difficulty": 0.65,
    "viewpoint": "supportive",
    "conceptIds": [
      "concept-2059bc5318a907c9509d",
      "concept-31e55046b3ece7183b1f",
      "concept-4e40bea07635c9f1e056",
      "concept-d1a35d9aaaa341fa2cd6",
      "concept-d33b22ce41f45ea7046e"
    ],
    "claimIds": [
      "claim-candidate-0000-01",
      "claim-candidate-0000-02"
    ],
    "suggestedQuestionIds": [
      "question-candidate-0000-01",
      "question-candidate-0000-02",
      "question-candidate-0000-03",
      "question-candidate-0000-04",
      "question-candidate-0000-05"
    ],
    "status": "frozen"
  },
  {
    "id": "candidate-0001",
    "topicId": "ai-agents-future-work",
    "sourceUrl": "https://arxiv.org/html/2511.12306v2",
    "sourcePlatform": "article",
    "sourceName": "arxiv.org",
    "author": "\\nameDarvin Yi \\emaildarvinyi@upwork.com",
    "originalTitle": "UpBench: A Dynamically Evolving Real-World Labor-Market Agentic Benchmark Framework Built for Human-Centric AI",
    "displayTitle": "UpBench: A Dynamically Evolving Labor-Market Benchmark for Agentic AI",
    "hook": "UpBench evaluates AI agent competence using real-world tasks from a freelance marketplace, grounding agent assessment in verifiable financial transactions and professional rubrics.",
    "shortSummary": "UpBench introduces a dynamically evolving evaluation framework for AI agents based on 322 verified, fixed-price jobs from the Upwork marketplace. By utilizing human-generated rubrics and per-criterion feedback, the benchmark allows for nuanced, high-fidelity assessment of agent performance and instruction-following capability in real-world professional contexts.",
    "longSummary": "UpBench addresses the limitations of static, synthetic benchmarks by using real freelance job data as an evaluation foundation. Each task represents a verified historical transaction, ensuring the benchmark reflects genuine professional standards and client demand. The framework integrates expert freelancers throughout the pipeline—curating jobs, defining acceptance criteria, and providing per-criterion feedback on AI submissions. This structure supports both autonomous evaluation and human-in-the-loop (HITL) workflows, allowing researchers to measure performance gains achieved after HITL re-attempts. With a focus on scalability and adaptability, UpBench includes an LLM-aided cluster analysis to identify prevalent failure patterns, providing a diagnostic tool for improving agentic alignment and reasoning in economically meaningful digital labor environments.",
    "language": "en",
    "readingTimeMinutes": 38,
    "collectedAt": "2026-07-17T02:41:51.289Z",
    "approvedAt": "2026-07-18T00:53:07.367Z",
    "qualityScore": 0.9,
    "interestingnessScore": 0.8,
    "educationalValueScore": 0.9,
    "difficulty": 0.65,
    "viewpoint": "supportive",
    "conceptIds": [
      "concept-3d119f7942924710c399",
      "concept-3e6d81a1a791c50d53f0",
      "concept-68e155f7aba2959df921",
      "concept-8bff63c3c31f843c2cd9",
      "concept-f0e5f53af7e637286fd5"
    ],
    "claimIds": [
      "claim-candidate-0001-01",
      "claim-candidate-0001-02"
    ],
    "suggestedQuestionIds": [
      "question-candidate-0001-01",
      "question-candidate-0001-02",
      "question-candidate-0001-03",
      "question-candidate-0001-04",
      "question-candidate-0001-05"
    ],
    "status": "frozen"
  },
  {
    "id": "candidate-0002",
    "topicId": "ai-agents-future-work",
    "sourceUrl": "https://arxiv.org/html/2604.00186v1",
    "sourcePlatform": "article",
    "sourceName": "arxiv.org",
    "author": "Ravish Gupta1 Corresponding author: ravishgupta@ieee.org",
    "originalTitle": "Agentic AI and Occupational Displacement: A Multi-Regional Task Exposure Analysis of Emerging Labor Market Disruption",
    "displayTitle": "Agentic AI and the Future of Occupational Displacement",
    "hook": "New research suggests that agentic AI, by executing end-to-end workflows rather than isolated tasks, creates a broad risk profile that prompts a re-evaluation of how we measure occupational displacement.",
    "shortSummary": "This study introduces the Agentic Task Exposure (ATE) score to assess how autonomous, multi-step AI systems may affect 236 occupations. Projections indicate that in the San Francisco Bay Area, a high-adoption Tier 1 region, the majority of information-intensive roles face significant displacement pressure by 2030.",
    "longSummary": "Moving beyond traditional task-level automation frameworks, this research introduces the Agentic Task Exposure (ATE) score, which accounts for the autonomous, multi-step workflow capabilities of modern agentic AI. By applying this framework to 236 occupations across five U.S. technology metros, the study finds that 93.2% of analyzed information-intensive roles are projected to reach a moderate-risk displacement threshold by 2030 in the San Francisco Bay Area, the study's sole Tier 1 metro. The authors argue that agentic AI may expose complete workflows that task-level frameworks do not capture. The analysis highlights that while displacement risk is broad, it is bounded by tasks requiring interpersonal, regulatory, or physical engagement. Furthermore, the paper identifies seventeen emerging 'reinstatement' roles—such as AI Governance and Agentic System Monitors—that demand domain-specific human judgment, suggesting a shift in reskilling strategies toward AI-directed expertise.",
    "language": "en",
    "readingTimeMinutes": 47,
    "collectedAt": "2026-07-17T02:41:51.315Z",
    "approvedAt": "2026-07-18T00:53:48.239Z",
    "qualityScore": 0.9,
    "interestingnessScore": 0.85,
    "educationalValueScore": 0.8,
    "difficulty": 0.6,
    "viewpoint": "neutral",
    "conceptIds": [
      "concept-3ab9805cb32fbdf257b3",
      "concept-3acd44b3729532f42dcd",
      "concept-465dad65bdb4765b02d1",
      "concept-ce070d0660ad51b45b5b",
      "concept-d923e20d267caeebae5e",
      "concept-f0e5f53af7e637286fd5"
    ],
    "claimIds": [
      "claim-candidate-0002-01",
      "claim-candidate-0002-02"
    ],
    "suggestedQuestionIds": [
      "question-candidate-0002-01",
      "question-candidate-0002-02",
      "question-candidate-0002-03",
      "question-candidate-0002-04",
      "question-candidate-0002-05"
    ],
    "status": "frozen"
  },
  {
    "id": "candidate-0003",
    "topicId": "ai-agents-future-work",
    "sourceUrl": "https://arxiv.org/html/2604.16337v1",
    "sourcePlatform": "article",
    "sourceName": "arxiv.org",
    "author": "Gabriel K. Moraes",
    "originalTitle": "HR-Agents: Using Multiple LLM-based Agents to Improve Q&A about Brazilian Labor Legislation",
    "displayTitle": "HR-Agents: Evaluating Multi-Agent Systems for Brazilian Labor Law Q&A",
    "hook": "A multi-agent LLM framework, utilizing role-based coordination, offers a promising but competitively complex approach to automating inquiries about Brazil's Consolidation of Labor Laws (CLT).",
    "shortSummary": "Researchers developed a multi-agent system using the CrewAI framework to assist with intricate queries regarding Brazil's Consolidation of Labor Laws (CLT). By assigning specialized roles—clerk, specialist, and chief—the system provides a competitive, role-based approach to legal inquiries, though single-model RAG pipelines achieved higher measured answer correctness in this study.",